{
  "$schema": "https://json-schema.org/draft/2020-12/schema",
  "$id": "schemas/events/event_envelope.v1.schema.json",
  "title": "CortAI Event Envelope v1",
  "type": "object",
  "additionalProperties": false,
  "required": [
    "event_id",
    "trace_id",
    "causation_id",
    "source",
    "type",
    "version",
    "ts",
    "payload"
  ],
  "properties": {
    "event_id": {
      "type": "string",
      "minLength": 1,
      "format": "uuid"
    },
    "trace_id": {
      "type": "string",
      "minLength": 1
    },
    "causation_id": {
      "type": [
        "string",
        "null"
      ],
      "minLength": 1
    },
    "source": {
      "type": "string",
      "minLength": 1,
      "pattern": "^[a-z0-9]+(\\.[a-z0-9_]+)+$"
    },
    "type": {
      "type": "string",
      "minLength": 1,
      "pattern": "^[a-z]+(\\.[a-z_]+)+$"
    },
    "version": {
      "type": "string",
      "const": "1",
      "pattern": "^[0-9]+$"
    },
    "ts": {
      "type": "string",
      "format": "date-time"
    },
    "payload": {
      "type": "object"
    }
  }
}
