{
  "event_id": "aa8aa916-b682-426a-b7e2-233ce49e14b1",
  "trace_id": "trace-20260301-0004",
  "causation_id": null,
  "source": "cortai.worker",
  "type": "maestro.job_started",
  "version": "1",
  "ts": "2026-03-01T00:01:00Z",
  "payload": {
    "job_id": "job-20260301-0001",
    "input_kind": "url",
    "demo_mode": false
  }
}
